{
  "query": "测试 UP",
  "subtitle": "Bilibili · 订阅中心",
  "platform": "Bilibili",
  "count": 10,
  "users": [
    {
      "rank": 1,
      "name": "示例 UP 一号",
      "uid_text": "UID 100000000000000001",
      "avatar": "assets/bilibili-default-avatar.gif",
      "fans_text": "粉丝 128.6万",
      "videos_text": "视频 233",
      "level_icon": "assets/lv6-senior.svg",
      "verify_text": "bilibili 知名UP主",
      "verify_org": false,
      "live": true,
      "sign": "这个签名用于检查搜索结果卡片的长文本截断效果，签名区域最多展示一行。"
    },
    {
      "rank": 2,
      "name": "示例 UP 二号",
      "uid_text": "UID 100000000000000002",
      "avatar": "assets/bilibili-default-avatar.gif",
      "fans_text": "粉丝 86.4万",
      "videos_text": "视频 152",
      "level_icon": "assets/lv6.svg",
      "verify_text": "bilibili 直播签约主播",
      "verify_org": true,
      "live": false,
      "sign": "每周三、五更新，感谢关注。"
    },
    {
      "rank": 3,
      "name": "示例 UP 三号",
      "uid_text": "UID 100000000000000003",
      "avatar": "assets/bilibili-default-avatar.gif",
      "fans_text": "粉丝 45.2万",
      "videos_text": "视频 98",
      "level_icon": "assets/lv5.svg",
      "verify_text": "",
      "verify_org": false,
      "live": false,
      "sign": ""
    },
    {
      "rank": 4,
      "name": "示例 UP 四号名字特别特别长用于检查省略",
      "uid_text": "UID 100000000000000004",
      "avatar": "",
      "fans_text": "粉丝 12.8万",
      "videos_text": "视频 45",
      "level_icon": "assets/lv4.svg",
      "verify_text": "",
      "verify_org": false,
      "live": false,
      "sign": "记录生活的日常账号。"
    },
    {
      "rank": 5,
      "name": "示例 UP 五号",
      "uid_text": "UID 100000000000000005",
      "avatar": "",
      "fans_text": "粉丝 8.6万",
      "videos_text": "视频 30",
      "level_icon": "assets/lv3.svg",
      "verify_text": "",
      "verify_org": false,
      "live": false,
      "sign": ""
    },
    {
      "rank": 6,
      "name": "示例 UP 六号",
      "uid_text": "UID 100000000000000006",
      "avatar": "",
      "fans_text": "粉丝 5.4万",
      "videos_text": "视频 21",
      "level_icon": "assets/lv2.svg",
      "verify_text": "",
      "verify_org": false,
      "live": false,
      "sign": "合作请联系邮箱。"
    },
    {
      "rank": 7,
      "name": "示例 UP 七号",
      "uid_text": "UID 100000000000000007",
      "avatar": "",
      "fans_text": "粉丝 3.2万",
      "videos_text": "视频 18",
      "level_icon": "assets/lv1.svg",
      "verify_text": "",
      "verify_org": false,
      "live": false,
      "sign": ""
    },
    {
      "rank": 8,
      "name": "示例 UP 八号",
      "uid_text": "UID 100000000000000008",
      "avatar": "",
      "fans_text": "粉丝 1.5万",
      "videos_text": "视频 12",
      "level_icon": "assets/lv0.svg",
      "verify_text": "",
      "verify_org": false,
      "live": false,
      "sign": ""
    },
    {
      "rank": 9,
      "name": "示例 UP 九号",
      "uid_text": "UID 100000000000000009",
      "avatar": "",
      "fans_text": "粉丝 8600",
      "videos_text": "视频 9",
      "level_icon": "assets/lv5.svg",
      "verify_text": "",
      "verify_org": false,
      "live": false,
      "sign": ""
    },
    {
      "rank": 10,
      "name": "示例 UP 十号",
      "uid_text": "UID 100000000000000010",
      "avatar": "",
      "fans_text": "粉丝 3200",
      "videos_text": "视频 4",
      "level_icon": "assets/lv6.svg",
      "verify_text": "",
      "verify_org": false,
      "live": false,
      "sign": ""
    }
  ],
  "footer_hint": "使用前缀 *：*订阅b站推送 [类型] UID或昵称"
}
